{"artifacts":[{"location":"optimization/artifacts/OPT-0022/raw/conv-transpose-subgroup-polyphase-ab.json","sha256":"6806deefda170661542577a4fe55d978ecb55bc957ced88cb97555c0e2e7bbfa"},{"location":"optimization/artifacts/OPT-0022/raw/conv-transpose-subgroup-polyphase-thermal-authoritative-valid.jsonl","sha256":"dda409ff5e63bc65b62b7d65f36a7f69f0256a0afc957263d000e34271bee949"}],"baselineCommit":"73a8a85334226a2f2eb888960796ade8875ea6ad","candidateCommit":"8345fce46c92afa109c1b38fa45d15df31b94de5","correctness":{"cleanup":{"activeMapCount":0,"createdBufferCount":110,"destroyedBufferCount":110,"deviceDestroyed":true,"drainBeforeRelease":true,"idempotent":true,"liveBufferCount":0,"liveBytes":0,"mapCount":100,"mapsBalanced":true,"maximumLiveBytes":987542272,"secondCallReachedZeroLiveResources":true,"unmapCount":100},"listeningDecision":null,"listeningRequired":false,"passed":true,"primitive":{"allPhasesCoveredInEveryProbe":true,"bothOneTapBoundariesCoveredPerOperation":true,"candidateVersusCurrentRawU16Exact":true,"deterministicRerunHashes":true,"exactGraphRangeCount":378,"guardsAndAdjacentCanariesUntouched":true,"immutableComparedBytes":334843904,"immutableSourceCount":20,"inverseLayoutComparedU16Count":49610752,"inverseLayoutMismatchCount":0,"operationCount":5,"outputComparedU16Count":8404992,"outputExactComparisonCount":30,"outputExecutionCount":60,"outputMismatchCount":0,"qNaNPrefillCompleteWrites":true,"selectedProbeCount":15,"uncapturedGpuErrorCount":0}},"disposition":{"rationale":"Retain the exactness and negative target-browser timing evidence. Keep integrated OPT-0015 as the production ConvTranspose owner; no converter, package, runtime, C300 production, long-window, waveform, listening, product, or integration escalation is authorized.","revisitWhen":["a materially changed browser compiler or target GPU invalidates this exact fixed32 subgroup screen","a separately registered ConvTranspose mechanism materially changes reduction precision or work ownership rather than sweeping nearby subgroup geometry or layout spellings"],"state":"abandoned"},"evidence":{"conclusion":"negative","rationale":"The candidate was raw-U16 exact across 8,404,992 output comparisons and the inverse polyphase layout matched all 49,610,752 weight words, but weighted C300 A/B was only 1.2605735458036402x versus the frozen 1.3398349037268882x threshold and block-2-conv-t1 regressed, so the primitive stop rule fired."},"experimentId":"OPT-0022","hypothesis":"Converter-native polyphase K-I-O weights plus a barrier-free fixed32 subgroup kernel can preserve exact tap/Cin arithmetic while removing OPT-0015's shared panels, barriers, and duplicated input loads.","identity":{"benchmarkHarnessCommit":"8345fce46c92afa109c1b38fa45d15df31b94de5","browserVersion":"Google Chrome 151.0.7922.138; reduced user agent 151.0.0.0","candidateCoreContractSha256":"19867f4400308a3ab8c321bdd609ed71e1af17421685532e6a21e514390234f6","candidateCoreSourceSha256":"b3a02e29419021d78f669b7ed0333b80c8e5739ed46d9d9645f814d971a9edfa","candidateKernelSetId":"ace-vae-fp16-fixed32-subgroup-polyphase-conv-transpose1d-v1","candidateWeightLayout":"conv-transpose1d-phase-tap-input-output-f16-v1","converterOrManifestChanged":false,"currentCoreSourceSha256":"cbcb9bcd5f856ce1c9e10aabca0ec0f95651c03d2c45b8076de3ba5022c6c3e2","currentKernelSetId":"ace-vae-fp16-congruent-two-tap-conv-transpose1d-v1","currentWeightLayout":"native-output-kernel-input-f16","executionProfile":"benchmark-only deterministic finite-FP16 five-operation C300 A=integrated OPT-0015 congruent native O-K-I, B=exact fixed32 subgroup polyphase K-I-O primitive gate; no package or production integration","fixtureManifestSha256":"cb9e0546c58be371581f302b8cd3943c3209ca1dcec296b75838ebf01c0cf7eb","generatedShaderHashes":[{"A":"891cf509d3a1753676ed4e352ff72b24d2dc3a8cab923af04109b979737455bf","B":"812c99bbbdb26a27cf06ca3f90247322a0b91de7254688c5d5fb4b155a8b963a","id":"block-0-conv-t1"},{"A":"5484dfeadd387c80aeffb5f696924642663e417b002dd8bf328bec247e34fcc6","B":"5997931ef29ad39982c98e45ef8620d57b3c5db25b1589e639ae4a0a6b1dfdc0","id":"block-1-conv-t1"},{"A":"a8d547c77e94c426d69b0d590f5d8fc35f8613e56da50df189d4556433f7bb7c","B":"529f81b8cc9a2a4a09849e024c2c543fba39dc514864e4c0294fdfeb17fc45ab","id":"block-2-conv-t1"},{"A":"91908682c7c1e65bea607463b66616329b8f5ac72c20c4cf093ffec5b5a6a549","B":"4f8e5b4d4e203d394f1fa39b2a3127d8fe3f05fb889c92c9d873fb5c7b83d732","id":"block-3-conv-t1"},{"A":"f560adea6e1369a438c30e5272861a194c486a70799c15b73eb26ca31ddcb2c7","B":"92921ab4159f36788fbf076fb1a2c1f10ad52adddb24f8a5689a9e045101f5f8","id":"block-4-conv-t1"}],"gpuCores":10,"harnessHtmlSha256":"b97ca849b7a2613f3e345cef49bfd50456a25931aab32cf8454adcd5a383d1dc","harnessSourceSha256":"4db0643edc6449087d6b28b5ee6dba3a3b0b9caabc2b4f8eb8d7a44bb27cadb8","integratedCurrentCommit":"36608b857827b2b1d31ac91bf5cca9639fb0b9ed","machineModel":"MacBook Air Mac15,12; Apple M3","memoryBytes":17179869184,"modelManifestSha256":"18f36c6420976475af65ecd833ca56c6119706322ce54120389d4915d8e80db6","osBuild":"macOS 26.5.2 build 25F84","packageIdentityRole":"Model and fixture manifests are provenance only; the primitive gate loaded no production package and directly constructed both immutable synthetic layouts.","preExecutionContractSha256":"64e3af52b7d50f7b6adff079a7f807382c1501417564f079fcb7287e0ecd3f21","productionIntegrationPerformed":false,"productionPackageLoaded":false,"productionRuntimeSelected":false,"rawArtifactBytes":{"receipt":68022,"thermal":6328},"recordedAt":"2026-08-15T08:01:19.566Z","registrationCommit":"88a1bc1f3ffb06a6ca714437ba8616c11ed212f2","vaeManifestSha256":"5644bcca87678b4f654b9541459355a73ef136c6bb601aa783b6f50fe2f6dba3","webgpuAdapter":{"features":["core-features-and-limits","shader-f16","subgroups"],"info":{"architecture":"metal-3","description":"","device":"","isFallbackAdapter":false,"subgroupMaxSize":32,"subgroupMinSize":32,"vendor":"apple"},"limits":{"maxBufferSize":268435456,"maxComputeInvocationsPerWorkgroup":256,"maxComputeWorkgroupSizeX":256,"maxComputeWorkgroupSizeY":256,"maxComputeWorkgroupStorageSize":16384,"maxStorageBufferBindingSize":147456000}}},"metrics":{"baseline":{"arm":"A-integrated-opt-0015-congruent-native-oki","operationMilliseconds":{"block-0-conv-t1":1379.6500012278557,"block-1-conv-t1":867.7499999403954,"block-2-conv-t1":656.5999971032143,"block-3-conv-t1":875.8499980568886,"block-4-conv-t1":848.8500009179115},"weightedC300Milliseconds":4628.699997246265},"candidate":{"arm":"B-fixed32-subgroup-polyphase-kio","bothTimingPositionsFaster":true,"c300ProductionRunPerformed":false,"converterAndPackageWorkPerformed":false,"everyOperationFaster":false,"longWindowRunPerformed":false,"m2250ProductRunPerformed":false,"operationMilliseconds":{"block-0-conv-t1":611.7999975085258,"block-1-conv-t1":798.0499990582466,"block-2-conv-t1":662.6499999761581,"block-3-conv-t1":867.8499971628189,"block-4-conv-t1":731.5500018596649},"packageNativeLayerGatePerformed":false,"productionIntegrationPerformed":false,"qualified":false,"waveformOrListeningRunPerformed":false,"weightedC300Milliseconds":3671.8999955654144},"delta":{"bothTimingPositionsFasterConditionPassed":true,"everyOperationFasterConditionPassed":false,"observed180SecondProductSpeedup":null,"observedIntegratedC300Speedup":null,"observedLongWindowSpeedup":null,"regressingOperations":["block-2-conv-t1"],"stopRuleFired":true,"under60SecondProjection":null,"weightedPrimitiveSavingMilliseconds":956.800001680851,"weightedSpeedup":1.2605735458036402,"weightedSpeedupConditionPassed":false,"weightedSpeedupThreshold":1.3398349037268882},"logicalGpuPeakBytes":987542272},"protocol":{"authoritativeTimedRunCount":1,"bothKernelsCompiledAndWarmedBeforeThermalGate":true,"continuousExternalThermalTraceThroughCleanup":true,"diagnosticLoggerSmokeAttempts":{"count":2,"pageLaunchCount":0,"result":"null levels detected and logger corrected before the sole authoritative run","timedDispatchCount":0},"dispatchSampleCount":180,"fullLayoutAndOutputCorrectnessCompletedBeforeThermalGate":true,"memorySamplingEnabled":false,"rejectedPagePreflights":{"benchmarkAttempts":0,"count":3,"reasons":[{"count":1,"reason":"stale launch delay of approximately 11 seconds exceeded the freshness cap"},{"count":2,"reason":"the original shell thermal loop drifted approximately 48 ms per poll, so 31 observations spanned approximately 31.47 seconds and failed observation-count/duration consistency because 32 observations were required"}],"timedDispatchCount":0,"timingSampleCount":0},"sampleTopology":"one dispatch in one command buffer followed by its matching queue-completion fence","samples":6,"thermal":{"cleanupCompletedAtEpochMilliseconds":1786780879566,"completedAtEpochMilliseconds":1786780876277,"durationMilliseconds":30001,"launchDelayMilliseconds":998,"maximumPollGapMilliseconds":1003,"nonNominalObservationCount":0,"observationCount":31,"postCleanupCoverageMilliseconds":52710,"source":"notifyutil-com.apple.system.thermalpressurelevel","startedAtEpochMilliseconds":1786780846276,"totalTraceLastEpochMilliseconds":1786780932276,"totalTraceMaximumPollGapMilliseconds":1004,"totalTraceObservationCount":111},"thermalGateSeconds":30,"thermalPollMilliseconds":1000,"thermalPollToleranceMilliseconds":250,"timingOrder":["AB","BA","AB","BA","AB","BA"],"timingRounds":6,"unchangedThermalRetryPerformed":false},"riskClass":"exact","schemaVersion":2}
