{"artifacts":[{"location":"optimization/artifacts/OPT-0016/raw/packed-kio-microtile-ab.json","sha256":"3bfbe588d5aa6595b3f49caff670cb62293157157e4a34d0fb12349265266222"}],"baselineCommit":"12e128ab323c0024ed683313b4d06c07041213e7","candidateCommit":"997891de0fe449c9b6551e80abc55604256969ad","correctness":{"cleanup":{"createdBufferCount":60,"destroyedBufferCount":60,"deviceDestroyed":true,"idempotent":true,"liveBufferCount":0,"liveBytes":0,"maximumLiveBytes":797584128},"fullPhase":{"comparedU16WordCount":null,"comparedU32WordCount":null,"executed":false,"reason":"no representative candidate reached 1.15x"},"listeningDecision":null,"listeningRequired":false,"passed":true,"primitive":{"candidateCount":3,"comparedU16WordCount":7176192,"comparedU32WordCount":3766272,"comparedWordCount":10942464,"deterministicRerunHashes":true,"executionsPerProbe":2,"guardsAndAdjacentCanariesUntouched":true,"mismatchCount":0,"probeCount":15,"qNaNPrefillCompleteWrites":true,"rawU16ExceptFinalRawU32":true,"representativeCount":5},"repack":{"comparedU16WordCount":19500544,"deterministicRerunHashes":true,"executionsPerOperation":2,"mismatchCount":0,"operationCount":5,"qNaNPrefillCompleteWrites":true,"redzonesUntouched":true,"repackWorkgroupCount":19044,"uniqueU16WordCount":9750272}},"disposition":{"rationale":"Do not integrate or repeat these nearby exact-order accumulator microtiles. Preserve the isolated cores and gate as benchmark evidence; no production selector or package layout changed.","revisitWhen":["a materially changed target browser, compiler, GPU, subgroup implementation, or source geometry invalidates this exact screen","a separately registered K7 mechanism accepts reordered rounding and declares tensor, denoise-step, waveform, and listening gates"],"state":"abandoned"},"evidence":{"conclusion":"negative","rationale":"All three microtiles were raw-bit exact, but their weighted representative speedups versus packed 16x64 were only 0.9779577975624927x, 0.9815300299687449x, and 1.007712087279326x. None reached the registered 1.15x threshold, so the declared early stop correctly skipped the complete C300 and production phases."},"experimentId":"OPT-0016","hypothesis":"Reducing each packed-KIO subgroup lane from 32 live FP32 accumulators to 16 or 8, while replacing u32 unpack with direct typed-FP16 KIO loads, can improve M3 occupancy enough to beat the packed 16x64 K7 control without changing K-then-Cin arithmetic.","identity":{"benchmarkHarnessCommit":"085669d5aec0fc02f3268c8b462385b59fb72ab7","browserVersion":"Google Chrome 151.0.0.0 (reduced user agent)","coreCommit":"997891de0fe449c9b6551e80abc55604256969ad","evaluatedProductionBaselineCommit":"36608b857827b2b1d31ac91bf5cca9639fb0b9ed","executionProfile":"benchmark-only deterministic finite-FP16 selected-five exact-C300 packed16x64-versus-microtile screen; synthetic bindings; conditional full phase not entered","fixed32CoreSourceSha256":"7d218516d6b2c8d6e3332a53101be5fdeae1142096c442433915bfa58941ce32","fixtureManifestSha256":"cb9e0546c58be371581f302b8cd3943c3209ca1dcec296b75838ebf01c0cf7eb","generatedShaderAggregateSha256":{"fixed32":"c11cc6fc47481942ed412ff0ff415774f6c0614b2f0280ae5353b74bbe040fc2","microtile16x32":"5b11f19a4824981b23022d7ec1ace9232f8a029d6fc6f0e21fd9f1c1028e81bf","microtile8x32":"c53f54625f49ec35c159ef8aebab870bfd839b65d7c6b2f0b98ba9ccc2237e0a","microtile8x64":"af34ce977ff42fca63652614cd8dddd412f8218001b68594c89de3862449fb26","packed16x64":"d38cdcbd0dbe61c6e302bd6d9a5d7810083e0c527c1e99961fa613ea06d285f1","repack":"31e664d13c27d626479f481cf0ca162748c9dd6b22753e1627e9cb0754217ef0"},"gpuCores":10,"harnessSourceSha256":{"html":"9d7ec2b447d5f31334724f6b84737f31663d04f9c6886d14e02989ea51d6f101","staticContract":"55d89681deb1021907e6180b80a39fa5e1fc97d700ac9a502a92e96c64a57186","typescript":"2e90b88d570864c1619654378a94c3e186391a6a9b07aaf847814b47ef7a7b8f"},"kernelIds":{"microtile16x32":"ace-vae-fp16-opt-0016-fixed32-packed-kio-k7-conv1d-16x32-v1","microtile8x32":"ace-vae-fp16-opt-0016-fixed32-packed-kio-k7-conv1d-8x32-v1","microtile8x64":"ace-vae-fp16-opt-0016-fixed32-packed-kio-k7-conv1d-8x64-v1","packed16x64":"ace-vae-fp16-opt-0014-fixed32-packed-kio-k7-conv1d-v1","repack":"ace-vae-fp16-opt-0014-o-k-i-to-k-i-o-u16-repack-v1"},"machineModel":"MacBook Air Mac15,12; Apple M3","memoryBytes":17179869184,"microtileCoreSourceSha256":"65658d149b31ca01346011ba83a7186f4550819e16bb4726e3d177d734b5cce3","modelManifestSha256":"18f36c6420976475af65ecd833ca56c6119706322ce54120389d4915d8e80db6","osBuild":"macOS 26.5.2 build 25F84","packageIdentityRole":"model and fixture manifests are provenance only; the gate used deterministic synthetic finite-FP16 tensors","packed16x64CoreSourceSha256":"802cb0ad1d2c57c0cc51cbd4a7c88632e00d543b526f2ed0b94e9fc393a3d8d8","packedControlCommit":"12e128ab323c0024ed683313b4d06c07041213e7","productionIntegrationPerformed":false,"productionPackageLoaded":false,"productionRuntimeSelected":false,"webgpuAdapter":{"features":["bgra8unorm-storage","clip-distances","core-features-and-limits","depth-clip-control","depth32float-stencil8","dual-source-blending","float32-blendable","float32-filterable","indirect-first-instance","primitive-index","rg11b10ufloat-renderable","shader-f16","subgroups","texture-component-swizzle","texture-compression-astc","texture-compression-astc-sliced-3d","texture-compression-bc","texture-compression-bc-sliced-3d","texture-compression-etc2","texture-formats-tier1","texture-formats-tier2","timestamp-query"],"info":{"architecture":"metal-3","description":"","device":"","isFallbackAdapter":false,"subgroupMaxSize":32,"subgroupMinSize":32,"vendor":"apple"},"limits":{"maxBufferSize":294913024,"maxComputeInvocationsPerWorkgroup":256,"maxComputeWorkgroupSizeX":256,"maxComputeWorkgroupsPerDimension":65535,"maxStorageBufferBindingSize":147456000,"minStorageBufferOffsetAlignment":256,"minUniformBufferOffsetAlignment":256}}},"metrics":{"baseline":{"arm":"packed16x64","exactC300OperationCount":17,"exactC300RangeCount":2404,"fullC300PackedPayloadBytesIfFullPhaseRuns":61017600,"omittedConv1RangeWeight":2,"representativeRangeWeight":2402,"selectedFivePackedPayloadBytes":19500544,"weightedRepresentativeMilliseconds":3331.9999829530716},"candidate":{"arms":{"16x32":{"qualified":false,"speedup":0.9815300299687449,"weightedRepresentativeMilliseconds":3394.6999900341034},"8x32":{"qualified":false,"speedup":1.007712087279326,"weightedRepresentativeMilliseconds":3306.499966621399},"8x64":{"qualified":false,"speedup":0.9779577975624927,"weightedRepresentativeMilliseconds":3407.0999702215195}},"bestArm":"8x32","bestSpeedup":1.007712087279326,"fullC300PackedPayloadBytesIfFullPhaseRuns":61017600,"fullPhaseExecuted":false,"productionIntegrationPerformed":false,"qualifyingArmCount":0,"remainingOperationAllocationPerformed":false,"selectedFivePackedPayloadBytes":19500544},"delta":{"fullSequenceSpeedup":null,"observed12SecondProductSpeedup":null,"observed180SecondProductSpeedup":null,"observedIntegratedDecoderSpeedup":null,"persistentPackedWeightBytesDeltaVersusControl":0,"productionIntegrationPerformed":false,"qualificationThreshold":1.15,"selectedWinner":null,"stopRuleFired":true,"under60SecondProjection":null},"logicalGpuPeakBytes":797584128},"protocol":{"armLabels":{"candidates":["8x64","16x32","8x32"],"control":"packed16x64"},"authoritativeTiming":"performance.now-submit-through-queue-drain","correctnessAndSelectedFiveRepackCompletedBeforeThermalGate":true,"fullSequenceThreshold":1.25,"memorySamplingEnabled":false,"qualificationThreshold":1.15,"representativeArmOrder":"cyclic-(tierIndex+sampleIndex)%4","representativePipelinesCompiledAndWarmedBeforeTiming":true,"representativePositionCounts":{"16x32":[4,4,4,3],"8x32":[3,4,4,4],"8x64":[4,4,3,4],"packed16x64":[4,3,4,4]},"samples":3,"thermal":{"completedAtEpochMilliseconds":1786754120159,"durationMilliseconds":30130,"launchDelayMilliseconds":76,"maximumPollGapMilliseconds":1005,"nonNominalObservationCount":0,"observationCount":31,"source":"notifyutil-com.apple.system.thermalpressurelevel","startedAtEpochMilliseconds":1786754090029},"thermalGateSeconds":30,"thermalPollMilliseconds":1000,"thermalPollToleranceMilliseconds":250,"unchangedThermalRetryPerformed":false},"riskClass":"exact","schemaVersion":2}
