{"artifacts":[{"location":"optimization/artifacts/OPT-0013/raw/dit-full-attention-query8-ab.json","sha256":"28a5a368f8b7fc8bf5771e415d8bd90db2ae7adba5961283a2b6010c459fbe28"}],"baselineCommit":"a88e1b41c7b127d20c3fc4dbdee63acb77612a8c","candidateCommit":"a88e1b41c7b127d20c3fc4dbdee63acb77612a8c","correctness":{"comparedElementCount":4608000,"comparedEveryOutputF32":true,"listeningDecision":null,"listeningRequired":true,"maximumAbsoluteError":2.6542693376541138e-8,"maximumAbsoluteErrorThreshold":0.0001,"meanAbsoluteError":1.560317666035174e-9,"nrmse":3.3672934508159816e-7,"nrmseThreshold":0.00001,"passed":true,"portableNonFiniteCount":0,"query8NonFiniteCount":0},"disposition":{"rationale":"The exact M2250 full-attention primitive gate is strongly positive, making query8 an immediate production-integration candidate behind authenticated fixed-32 subgroup selection. The benchmark did not run a layer, denoise trajectory, final latent, listening gate, song, or product path and therefore remains benchmark-only.","revisitWhen":["query8 is selected in a registered production integration candidate","the applicable layer, denoise-trajectory, final-latent, and listening gates are available","browser, compiler, GPU, subgroup capability, source, shader, or production shape identity changes"],"state":"benchmark-only"},"evidence":{"conclusion":"positive","rationale":"On the immutable exact production full-attention shape, query8 compared every one of 4,608,000 F32 outputs with maximum absolute error 2.6542693376541138e-8, NRMSE 3.3672934508159816e-7, and no non-finite values. It reduced compute wall from 1108.8 to 136.2 ms (8.140969x) and full drain/readback wall from 1117.3 to 140.2 ms (7.969330x), consistent with 7.992895x fewer estimated global K/V scalar loads. This is positive primitive benchmark evidence, not a production, listening, song, or product-speed result."},"experimentId":"OPT-0013","hypothesis":"At the production M2250 full-attention shape, eight fixed-32 subgroups can share each 128-dimensional K/V tile across two GQA heads and four adjacent queries, materially reducing K/V rereads and barriers while retaining FP32 online-softmax state and per-key update order.","identity":{"attentionSourceSha256":"5f64e5148ee60f26023faeb99ac72b46354086f3db48f7778800a9061d2b9ed3","benchmarkHarnessCommit":"5b9cc1852e5178c8bbb907dbe4c90eae6004d6b8","browserVersion":"Google Chrome 151.0.0.0 (reduced user agent)","checkpointCommit":"a88e1b41c7b127d20c3fc4dbdee63acb77612a8c","deterministicInputs":{"generator":"lcg1664525-u24-f32-v1","keySeed":610839776,"keySha256":"806a53b579be00ea2f49675c733f2db60e75c01159c58f20a3e4be5074403c44","querySeed":324508639,"querySha256":"3a8be2a8feda56412ec2e38ea0fbf5ea9dc628523ea8436b9364f5edf9f02440","valueSeed":270544960,"valueSha256":"54c804aada107071e0238a8ae4c2ed3b480ad38ce5b8e8f54b581cb0a0975cba"},"executionProfile":"benchmark-only deterministic-F32 exact-M2250 full attention; portable then fixed32-subgroup-query8; no production package loaded or runtime default selected","fixtureManifestSha256":"cb9e0546c58be371581f302b8cd3943c3209ca1dcec296b75838ebf01c0cf7eb","gpuCores":10,"harnessSourceSha256":{"html":"61abb352278e336f3e94b7a306691c7de7f04d3e4a02325a832f778227a43489","staticContract":"126242d90a15cf123950f3702809f37021016defb511e1e172ce7e7c2e0cc509","typescript":"791bf74274fe404eccfe4bbf3c1de1bed7ed6fec877f1e16da2e590e268064fe"},"machineModel":"MacBook Air Mac15,12; Apple M3","memoryBytes":17179869184,"modelManifestSha256":"18f36c6420976475af65ecd833ca56c6119706322ce54120389d4915d8e80db6","osBuild":"macOS 26.5.2 build 25F84","packageIdentityRole":"model and fixture manifests are provenance only; the gate used deterministic synthetic F32 tensors","portableWgslSha256":"6052f3e86f03ad3f7f3dc80384c63fa3750c0a038b68af0689914c5087929121","productionPackageLoaded":false,"productionRuntimeSelected":false,"query8WgslSha256":"176cd0988c11944fb47cce813e4b6338d867507a00cf416845920c642aec71a4","webgpuAdapter":{"features":["bgra8unorm-storage","clip-distances","core-features-and-limits","depth-clip-control","depth32float-stencil8","dual-source-blending","float32-blendable","float32-filterable","indirect-first-instance","primitive-index","rg11b10ufloat-renderable","shader-f16","subgroups","texture-component-swizzle","texture-compression-astc","texture-compression-astc-sliced-3d","texture-compression-bc","texture-compression-bc-sliced-3d","texture-compression-etc2","texture-formats-tier1","texture-formats-tier2","timestamp-query"],"info":{"architecture":"metal-3","description":"","device":"","isFallbackAdapter":false,"subgroupMaxSize":32,"subgroupMinSize":32,"vendor":"apple"},"limits":{"maxBufferSize":268435456,"maxComputeInvocationsPerWorkgroup":256,"maxComputeWorkgroupSizeX":256,"maxComputeWorkgroupStorageSize":16384,"maxComputeWorkgroupsPerDimension":65535,"maxStorageBufferBindingSize":134217728,"minUniformBufferOffsetAlignment":256}}},"metrics":{"baseline":{"backend":"portable","barriersPerKey":10,"commandBufferCount":2,"computeWallMilliseconds":1108.7999999523163,"keyValueBytes":82944000000,"keyValueScalarLoads":20736000000,"outputSha256":"df90123ababd0182d7c7b4f6ec1604e4673ab7530cbc61eba41e14c5d0985d39","queueDrainCount":2,"readbackWallMilliseconds":8.5,"totalWallMilliseconds":1117.2999999523163,"workgroupCount":36000},"candidate":{"backend":"fixed32-subgroup-query8","barriersPerKey":2,"commandBufferCount":2,"computeWallMilliseconds":136.19999992847443,"keyValueBytes":10377216000,"keyValueScalarLoads":2594304000,"outputSha256":"b252684edb92fcc50beec55d300741e48fe103f43bbb65b03c2f6b958e03afa2","productionIntegrationPerformed":false,"query8RangeCount":5,"query8RangeWorkgroups":[932,932,932,932,776],"queueDrainCount":2,"readbackWallMilliseconds":4,"scope":{"batch":1,"headDimension":128,"keyValueHeads":8,"keyValueTokens":2250,"mode":"full","queryHeads":16,"queryTokens":2250},"totalWallMilliseconds":140.19999992847443,"workgroupCount":4504},"delta":{"barrierReduction":5,"computeWallSpeedup":8.140969166920733,"keyValueLoadReduction":7.992895204262878,"observedEndToEnd":false,"productionIntegrationPerformed":false,"totalWallSpeedup":7.969329532969523}},"protocol":{"armLabels":{"A":"portable","B":"fixed32-subgroup-query8"},"commandBuffersPerArm":2,"compileOutsideTiming":true,"exactPipelineWarmupOutsideTiming":true,"memorySamplingEnabled":false,"outputReadbackBytesPerArm":18432000,"pairedOrder":["A","B"],"queueDrainsPerArm":2,"samples":1,"thermal":{"durationMilliseconds":30010.05517578125,"launchDelayMilliseconds":71.43701171875,"maximumPollGapMilliseconds":1010.141357421875,"nonNominalObservationCount":0,"observationCount":31,"source":"notifyutil-com.apple.system.thermalpressurelevel"},"thermalGateSeconds":30,"thermalPollMilliseconds":1000,"thermalPollToleranceMilliseconds":250,"timedWallIncludesComputeDrainCopyMapAndFullCpuReadback":true,"unchangedThermalRetryPerformed":false,"warmupValidKeyTokens":1,"warmupValidQueryTokens":1,"warmupWallMilliseconds":3.399999976158142},"riskClass":"reordered-rounding","schemaVersion":2}
