{"artifacts":[{"location":"optimization/artifacts/OPT-0019/raw/dense-cooperative-panels-ab.json","sha256":"a2434a16dae3db3936202461a6da6548009148c739da58dd80f458931f55471d"},{"location":"optimization/artifacts/OPT-0019/raw/dense-cooperative-panels-thermal.jsonl","sha256":"ebb0e4000e68338cd29cd5a888e0ee635cb95f54a745eec25612d2bf26e4bf9f"}],"baselineCommit":"f92de5a209ebb5f05ba9b37e5f3b7bfc88633d82","candidateCommit":"8900ce670271cbd227142c584fb4a917e5d9cfb9","correctness":{"cleanup":{"createdBufferCount":20,"destroyedBufferCount":20,"deviceDestroyed":true,"idempotent":true,"liveBufferCount":0,"liveBytes":0,"maximumLiveBytes":311749632},"listeningDecision":null,"listeningRequired":false,"passed":true,"primitive":{"canariesUntouched":true,"candidateVersusCurrentRawU32Exact":true,"comparedU32Count":101376000,"comparisonsPerOutputWord":4,"deterministicReruns":true,"executionCount":16,"finiteOutputs":true,"mismatchCount":0,"qNaNPrefillCompleteWrites":true,"shapeCount":4,"tailRowsWritten":true}},"disposition":{"rationale":"Preserve the exact cooperative-panel core, bounded gate, and negative evidence as benchmark history. The production OPT-0009 dense owner, package, runtime selector, and product profile remain unchanged.","revisitWhen":["a materially changed browser compiler or target GPU invalidates this exact screen","a separately registered dense mechanism materially changes tiling, staging, or reduction machinery rather than repeating this M64xN128xK16 cooperative panel"],"state":"abandoned"},"evidence":{"conclusion":"negative","rationale":"The candidate was raw-U32 exact and faster on all four shapes, but its complete 4/2/2/1 production-dense score improved only from 223.20000022649765 to 169.69999998807907 ms: 1.3152622288873117x and 53.50000023841858 ms saved. It cleared the absolute-saving condition but missed the frozen 1.55x ratio, so the registered stop rule forbids package-native escalation, production integration, and an M2250 integration run."},"experimentId":"OPT-0019","hypothesis":"A WG256 M64xN128xK16 cooperative FP16 panel can remove duplicated packed-weight traffic and halve per-thread FP32 accumulator pressure while preserving increasing-K arithmetic across every production dense projection.","identity":{"benchmarkHarnessCommit":"8900ce670271cbd227142c584fb4a917e5d9cfb9","browserVersion":"Google Chrome 151.0.7922.138; reduced user agent 151.0.0.0","candidateCoreSourceSha256":"b5dad12724882d3fc942c7df7b10c7b7b89a4bed595125ff11a5905c03152a37","candidateKernelSetId":"opt-0019-m64-n128-k16-cooperative-fp16-fp32-v1","coreCommit":"8900ce670271cbd227142c584fb4a917e5d9cfb9","currentCoreSourceSha256":"a238f67da07c6ba1097da9d9e9e97960ae97d2e1d5c129fcbabf69e962cbb6b3","evaluatedProductionBaselineCommit":"f92de5a209ebb5f05ba9b37e5f3b7bfc88633d82","executionProfile":"benchmark-only deterministic synthetic-native-FP16 M2250 four-shape current-versus-cooperative-panel exact primitive gate; no package or production integration","fixtureManifestSha256":"cb9e0546c58be371581f302b8cd3943c3209ca1dcec296b75838ebf01c0cf7eb","gpuCores":10,"machineModel":"MacBook Air Mac15,12; Apple M3","memoryBytes":17179869184,"modelManifestSha256":"18f36c6420976475af65ecd833ca56c6119706322ce54120389d4915d8e80db6","osBuild":"macOS 26.5.2 build 25F84","packageIdentityRole":"model and fixture manifests are provenance only; the gate used deterministic synthetic FP32 activations and native-FP16 packed weights","productionIntegrationPerformed":false,"productionPackageLoaded":false,"productionRuntimeSelected":false,"registrationCommit":"83de738b5374699778dcaa373d69118a7fbd6715","webgpuAdapter":{"features":["core-features-and-limits","shader-f16","subgroups"],"info":{"architecture":"metal-3","description":"","device":"","isFallbackAdapter":false,"subgroupMaxSize":32,"subgroupMinSize":32,"vendor":"apple"},"limits":{"maxBufferSize":268435456,"maxComputeInvocationsPerWorkgroup":256,"maxComputeWorkgroupSizeX":256,"maxComputeWorkgroupSizeY":256,"maxComputeWorkgroupStorageSize":16384,"maxStorageBufferBindingSize":134217728}}},"metrics":{"baseline":{"arm":"current-opt-0009","completeDenseMilliseconds":223.20000022649765,"completeDenseMultiplicities":"4/2/2/1","feedForwardMilliseconds":138.79999989271164,"feedForwardMultiplicities":"0/0/2/1","shapeMedianMilliseconds":{"6144-h":44.30000001192093,"h-1024":9.300000071525574,"h-6144":47.249999940395355,"h-h":16.450000047683716}},"candidate":{"arm":"cooperative-panel","completeDenseMilliseconds":169.69999998807907,"everyShapeFaster":true,"feedForwardMilliseconds":109.99999994039536,"m2250IntegrationRunPerformed":false,"packageNativeEscalationPerformed":false,"productionIntegrationPerformed":false,"qualified":false,"shapeMedianMilliseconds":{"6144-h":36.69999998807907,"h-1024":6.149999976158142,"h-6144":36.64999997615814,"h-h":11.850000023841858}},"delta":{"completeDenseSavingMilliseconds":53.50000023841858,"completeDenseSpeedup":1.3152622288873117,"everyShapeFasterConditionPassed":true,"feedForwardSavingMilliseconds":28.799999952316284,"feedForwardSpeedup":1.2618181815265623,"observed180SecondProductSpeedup":null,"observedIntegratedDitSpeedup":null,"savingConditionPassed":true,"savingThresholdMilliseconds":52.0834,"speedupConditionPassed":false,"speedupThreshold":1.55,"stopRuleFired":true,"under60SecondProjection":null},"logicalGpuPeakBytes":311749632},"protocol":{"armOrder":"AB in rounds 1/3 and BA in rounds 2/4; shape order left-rotated by round","authoritativeTimedRunCount":1,"authoritativeTiming":"performance.now immediately before submit through matching queue drain","bothKernelsCompiledAndWarmedBeforeThermalGate":true,"continuousExternalThermalTraceThroughCleanup":true,"fullOutputCorrectnessCompletedBeforeThermalGate":true,"memorySamplingEnabled":false,"rejectedPreflight":{"count":1,"reason":"stale thermal timestamps","timedDispatchCount":0,"timingSampleCount":0},"samples":4,"thermal":{"completedAtEpochMilliseconds":1786768533984,"durationMilliseconds":44406,"launchDelayMilliseconds":907,"maximumPollGapMilliseconds":1012,"nonNominalObservationCount":0,"observationCount":45,"source":"notifyutil-com.apple.system.thermalpressurelevel","startedAtEpochMilliseconds":1786768489578},"thermalGateSeconds":30,"thermalPollMilliseconds":1000,"thermalPollToleranceMilliseconds":250,"unchangedThermalRetryPerformed":false},"riskClass":"exact","schemaVersion":2}
