{"artifacts":[{"location":"optimization/artifacts/OPT-0017/raw/cooperative-dot4-k7-ab.json","sha256":"903d810d5c0ea4f0c411587cdeffbc90a462690bb9cd570a1665b619ec7eebb2"}],"baselineCommit":"36608b857827b2b1d31ac91bf5cca9639fb0b9ed","candidateCommit":"b83f4fe94d56787ddb980629ea6f41804543ca69","correctness":{"cleanup":{"createdBufferCount":83,"destroyedBufferCount":83,"deviceDestroyed":true,"idempotent":true,"liveBufferCount":0,"liveBytes":0,"maximumLiveBytes":580667392},"fullPhase":{"executed":false,"fullSequenceAllocationPerformed":false,"reason":"weighted representative speedup 0.5255788875168637x was below the frozen 1.75x qualification threshold"},"listeningDecision":null,"listeningRequired":false,"numerical":{"aggregate":{"candidateOutputRange":{"maximum":0.056182861328125,"minimum":-0.0537109375},"comparedValueCount":2392064,"controlOutputRange":{"maximum":0.056182861328125,"minimum":-0.0537109375},"fp16UlpDistribution":{"0":2390380,"1":1684},"maximumAbsoluteError":0.000030517578125,"meanError":-2.667685007446841e-10,"nrmse":0.000009066605130144652,"pearson":0.9999999999588972,"relativeMaximumAbsoluteError":0.0005431830526887561,"rmsError":1.6688909076031648e-7,"signedZeroDifferenceCount":0,"snrDb":100.85110596605332},"candidateVersusShippedFixed32":true,"completeFiniteWrites":true,"deterministicCandidateRerunHashes":true,"executionsPerProbe":2,"guardsAndAdjacentCanariesUntouched":true,"passed":true,"probeCount":12,"qNaNPrefillCompleteWrites":true,"thresholds":{"nrmseMaximum":0.001,"pearsonMinimum":0.99999,"relativeMaximumAbsoluteErrorMaximum":0.01,"snrMinimumDb":60}},"passed":true,"repack":{"comparedU16WordCount":40255488,"deterministicSelectedRerunHashes":true,"mismatchCount":0,"operationCount":16,"packedPayloadBytes":61014016,"qNaNPrefillCompleteWrites":true,"redzonesUntouched":true,"repackWorkgroupCount":59584,"selectedOperationCount":4,"selectedRepackWorkgroupCount":19040,"selectedUniqueU16WordCount":9748480,"uniqueU16WordCount":30507008}},"disposition":{"rationale":"Preserve the isolated cooperative-dot4 core, gate, and negative evidence as benchmark history, but do not integrate this shared-panel/R32/dot4 geometry or its packed-weight payload into a production profile.","revisitWhen":["a materially changed browser compiler, GPU architecture, subgroup implementation, or production K7 geometry invalidates this exact screen","a separately registered K7 mechanism materially changes operand staging, barrier structure, or reduction machinery rather than repeating this cooperative-dot4 tile"],"state":"abandoned"},"evidence":{"conclusion":"negative","rationale":"All-16 KIO repack correctness and every frozen representative numerical bound passed, but cooperative dot4 regressed the weighted 2,397-range primitive projection from 13,761.599894106388 to 26,183.699956297874 ms, only 0.5255788875168637x the shipped fixed32 speed. It missed the registered 1.75x threshold, so the full C300, production, waveform, listening, and long-run phases were not entered and no integration occurred."},"experimentId":"OPT-0017","hypothesis":"A WG256 adaptive cooperative implicit-GEMM tile with shared FP16 R32 panels and FP32 dot4 reduction groups can materially accelerate the 16 biased production K7 operations while remaining inside a declared reordered-rounding quality envelope.","identity":{"benchmarkHarnessCommit":"c34efbb67017c679c7932eed1df783254af17631","browserVersion":"Google Chrome 151.0.0.0 (reduced user agent)","cooperativeCoreSourceSha256":"83987aa9b16e05a5b6f45c25ebfe33ed08bfb82ae94bd9dfb4fb624c625407b8","coreCommit":"b83f4fe94d56787ddb980629ea6f41804543ca69","evaluatedProductionBaselineCommit":"36608b857827b2b1d31ac91bf5cca9639fb0b9ed","executionProfile":"benchmark-only deterministic finite-FP16 exact-C300 16-operation shipped-fixed32-versus-cooperative-dot4 K7 primitive gate; synthetic bindings; conditional full sequence not entered","fixed32CoreSourceSha256":"7d218516d6b2c8d6e3332a53101be5fdeae1142096c442433915bfa58941ce32","fixtureManifestSha256":"cb9e0546c58be371581f302b8cd3943c3209ca1dcec296b75838ebf01c0cf7eb","generatedShaderAggregateSha256":{"cooperativeDot4":"60e76e4fd34ed10855aea1f47d6150de17e5351d29e1b840fd3f223bcf6d7bfb","fixed32":"05821b6fa9aba1dec3bdca50bd66ddc1879b5652f7c532b792e625364c65e3a6","repack":"6e57e400c470187050e66b2ac705ac63541286b0cf94e4cebd9667a1068c6afd"},"gpuCores":10,"harnessSourceSha256":{"html":"90fa2085071cf1b2591e98a41e03859d8ea52862da44e44b9f0b9e4243819002","staticContract":"c5a79adfb480535d1daf92d70e6efe73e5561c8ec34e9744e9a940d76fbcd6cc","typescript":"3735a8ccb0f978ee1f24a6db53efefdbe6a2f13ff16d79091b9b6150f6712003"},"kernelIds":{"cooperativeDot4":"ace-vae-fp16-opt-0017-reordered-dot4-packed-kio-k7-conv1d-v1","fixed32":"ace-vae-fp16-fixed32-subgroup-k7-conv1d-v1","repack":"ace-vae-fp16-opt-0014-o-k-i-to-k-i-o-u16-repack-v1"},"machineModel":"MacBook Air Mac15,12; Apple M3","memoryBytes":17179869184,"modelManifestSha256":"18f36c6420976475af65ecd833ca56c6119706322ce54120389d4915d8e80db6","osBuild":"macOS 26.5.2 build 25F84","packageIdentityRole":"model and fixture manifests are provenance only; the gate used deterministic synthetic finite-FP16 tensors","packedKioCoreSourceSha256":"802cb0ad1d2c57c0cc51cbd4a7c88632e00d543b526f2ed0b94e9fc393a3d8d8","productionIntegrationPerformed":false,"productionPackageLoaded":false,"productionRuntimeSelected":false,"webgpuAdapter":{"features":["bgra8unorm-storage","clip-distances","core-features-and-limits","depth-clip-control","depth32float-stencil8","dual-source-blending","float32-blendable","float32-filterable","indirect-first-instance","primitive-index","rg11b10ufloat-renderable","shader-f16","subgroups","texture-component-swizzle","texture-compression-astc","texture-compression-astc-sliced-3d","texture-compression-bc","texture-compression-bc-sliced-3d","texture-compression-etc2","texture-formats-tier1","texture-formats-tier2","timestamp-query"],"info":{"architecture":"metal-3","description":"","device":"","isFallbackAdapter":false,"subgroupMaxSize":32,"subgroupMinSize":32,"vendor":"apple"},"limits":{"maxBufferSize":268435456,"maxComputeInvocationsPerWorkgroup":256,"maxComputeWorkgroupSizeX":256,"maxComputeWorkgroupsPerDimension":65535,"maxStorageBufferBindingSize":147456000,"minStorageBufferOffsetAlignment":256,"minUniformBufferOffsetAlignment":256}}},"metrics":{"baseline":{"arm":"shipped-fixed32","exactC300OperationCount":16,"exactC300RangeCount":2399,"omittedConv1RangeWeight":2,"omittedShippedFinalConv2RangeWeight":5,"persistentPackedWeightBytes":0,"representativeRangeWeight":2397,"weightedRepresentativeMilliseconds":13761.599894106388},"candidate":{"arm":"cooperative-dot4","exactC300OperationCount":16,"exactC300RangeCount":2399,"fullPhaseExecuted":false,"fullSequenceAllocationPerformed":false,"packedPayloadBytesAllocatedForGate":61014016,"persistentPackedWeightBytesIfIntegrated":61014016,"productionIntegrationPerformed":false,"qualificationThreshold":1.75,"qualified":false,"weightedRepresentativeMilliseconds":26183.699956297874},"delta":{"candidateSlowdownFactor":1.9026639458913086,"fullSequenceSpeedup":null,"observed12SecondProductSpeedup":null,"observed180SecondProductSpeedup":null,"observedIntegratedDecoderSpeedup":null,"productionIntegrationPerformed":false,"productionPersistentPackedWeightBytesDelta":0,"representativeSavingMilliseconds":-12422.100062191486,"representativeSpeedup":0.5255788875168637,"selectedWinner":null,"stopRuleFired":true,"under60SecondProjection":null},"logicalGpuPeakBytes":580667392},"protocol":{"armLabels":{"candidate":"cooperativeDot4","control":"fixed32"},"authoritativeTiming":"performance.now-submit-through-queue-drain","fullSequenceQualificationThreshold":2,"memorySamplingEnabled":false,"numericalAndAll16RepackCompletedBeforeThermalGate":true,"representativeArmOrder":"alternating-AB/BA-by-tier-and-sample","representativePipelinesCompiledAndWarmedBeforeTiming":true,"representativePositionCounts":{"cooperativeDot4":[8,8],"fixed32":[8,8]},"representativeQualificationThreshold":1.75,"samples":4,"thermal":{"completedAtEpochMilliseconds":1786759189299,"durationMilliseconds":30198,"launchDelayMilliseconds":81,"maximumPollGapMilliseconds":1015,"nonNominalObservationCount":0,"observationCount":31,"source":"notifyutil-com.apple.system.thermalpressurelevel","startedAtEpochMilliseconds":1786759159101},"thermalGateSeconds":30,"thermalPollMilliseconds":1000,"thermalPollToleranceMilliseconds":250,"unchangedThermalRetryPerformed":false},"riskClass":"reordered-rounding","schemaVersion":2}
