{"artifacts":[{"location":"optimization/artifacts/OPT-0004/raw/representative-paired-ab.json","sha256":"6582588efa752d4203238a329be10ad4d36a95503c72db133c451e63b31c211c"},{"location":"optimization/artifacts/OPT-0004/raw/representative-thermal.jsonl","sha256":"317ca8806148f9ce375c26d14e98dc512a12d46fb1b4da80badc00965b32999f"},{"location":"optimization/artifacts/OPT-0004/raw/integrated-decoder-correctness.json","sha256":"433473d1863359da83d4917dc8745076885491df8f1c23029aebda7866fdf9e1"}],"baselineCommit":"4c43b1434fa286251538fc44098b691b05d15da2","candidateCommit":"48148ad1c791d26653d95418f55720240bafddff","correctness":{"listeningDecision":null,"listeningRequired":false,"oracleManifestSha256":"cb9e0546c58be371581f302b8cd3943c3209ca1dcec296b75838ebf01c0cf7eb","passed":true},"disposition":{"rationale":"Production commit 48148ad integrates the proven exact K7 kernel through a fail-closed tiled-when-eligible selector with scalar fallback. An actual-Chrome complete one-block C128 decoder comparison produced zero final-output U32 mismatches between forced-portable and production-default profiles; FIFO scheduling, bounded range drains, resource lifecycle, and existing backend cancellation contracts remain intact.","revisitWhen":["profiling makes additional K7 shapes or a larger workgroup-memory profile decision-relevant","a demonstrably better incompatible Conv1D implementation supersedes the integrated kernel","a VAE-window, waveform, or song run becomes decision-relevant for the end-to-end objective"],"state":"integrated"},"evidence":{"conclusion":"positive","rationale":"On the pinned Chrome/M3 target, the benchmark-local tiled K7 FP32 Conv1D was bit-identical to the accepted scalar GPU kernel across the complete manageable multi-range preflight and 786,432 first/middle/last representative output elements, won all four balanced paired rounds, and reduced representative median active wall time from 632.0 ms to 211.5 ms (2.988x ratio of medians). Scalar active wall time drifted from 721.5 to 456.2 ms, but all four same-round comparisons favored the stable candidate and the least favorable pair was still 2.120x. This establishes a strong positive direction for staged integration, not full-operation, decoder, waveform, or end-to-end performance. Production commit 48148ad subsequently integrated the fail-closed selector; an actual-Chrome complete one-block C128 decoder A/B had zero final-output U32 mismatches while exercising both tiled and portable fallback paths."},"experimentId":"OPT-0004","hypothesis":"A benchmark-local workgroup-tiled FP32 K7 Conv1D can reuse shared input halos and weight tiles across adjacent output times and channels while preserving target-browser scalar output bits.","identity":{"benchmarkHarnessCommit":"eab519804278a0ff1a69616efed0191254983471","browserVersion":"Google Chrome 151.0.7922.138; reduced user agent 151.0.0.0","executionProfile":"reference-bf16-subgroups; VAE FP32; production tiled-when-eligible K7 Conv1D","fixtureManifestSha256":"cb9e0546c58be371581f302b8cd3943c3209ca1dcec296b75838ebf01c0cf7eb","gpuCores":10,"machineModel":"MacBook Air Mac15,12; Apple M3","memoryBytes":17179869184,"modelManifestSha256":"d133b21d55bb6c00ad132aeaa83549ccec1a06c581c9b259268670dcf694fb55","osBuild":"macOS 26.5.2 build 25F84","productionIntegrationCommit":"48148ad1c791d26653d95418f55720240bafddff","webgpuAdapter":{"features":["bgra8unorm-storage","clip-distances","core-features-and-limits","depth-clip-control","depth32float-stencil8","dual-source-blending","float32-blendable","float32-filterable","indirect-first-instance","primitive-index","rg11b10ufloat-renderable","shader-f16","subgroups","texture-component-swizzle","texture-compression-astc","texture-compression-astc-sliced-3d","texture-compression-bc","texture-compression-bc-sliced-3d","texture-compression-etc2","texture-formats-tier1","texture-formats-tier2","timestamp-query"],"info":{"architecture":"metal-3","description":"","device":"","isFallbackAdapter":false,"vendor":"apple"},"limits":{"maxBufferSize":4294967292,"maxComputeInvocationsPerWorkgroup":1024,"maxComputeWorkgroupSizeX":1024,"maxComputeWorkgroupSizeY":1024,"maxComputeWorkgroupStorageSize":32768,"maxComputeWorkgroupsPerDimension":65535,"maxStorageBufferBindingSize":4294967292}}},"metrics":{"baseline":{"kernel":"AceCorrectnessVaePrimitiveKernel","maximumSingleDrainMilliseconds":46.30000001192093,"representativeActiveWallMilliseconds":{"max":721.4999999403954,"median":632.0000001192093,"min":456.20000010728836,"range":265.299999833107,"sampleCount":4,"samples":[721.4999999403954,649.0000001788139,615.0000000596046,456.20000010728836]},"representativeLogicalGmacPerSecond":{"max":16.475221740974135,"median":11.90100986444898,"min":10.41718109580168,"range":6.058040645172454,"sampleCount":4,"samples":[10.41718109580168,11.580887762602737,12.221131966295225,16.475221740974135]}},"candidate":{"benchmarkScope":"one thermally valid page run over a 65,536-frame production-geometry representative with four balanced in-page paired rounds; the complete 491,520-frame operation, full VAE window, and song were not executed","cancellation":{"activeRangeDrained":true,"laterRangeSubmissionPrevented":true,"plannedRangeCount":3,"rangesSubmitted":1,"triggerDelivered":true},"completeProductionOperationExecuted":false,"correctness":{"contractedDiscriminantBits":"0xbe7d3830","manageablePreflightCaseBitMismatchCounts":[0,0,0],"manageablePreflightCpuSentinelsBitExact":[true,true,true],"productionRepresentativeBitMismatchCount":0,"productionRepresentativeComparedElements":786432,"productionRepresentativeCpuSentinelsBitExact":true,"reassociatedCancellation":1.5,"sourceOrderCancellation":0.5},"externalThermalCoverage":{"durationMilliseconds":91336.21612499701,"maximumPollGapMilliseconds":1010.035,"nonNominalObservationCount":0,"observationCount":92,"spansPreGateRunAndPostRun":true},"fullSongExecuted":false,"fullVaeWindowExecuted":false,"integratedDecoderCorrectness":{"actualChromePerformed":true,"finalOutputBitMismatchCount":0,"finalOutputValuesChecked":12,"maximumCpuAbsoluteError":0.000885009765625,"portableFallbackOperationLabels":["block-0-res-1-conv2","block-0-res-2-conv1","block-0-res-2-conv2","block-0-res-3-conv1","block-0-res-3-conv2"],"scope":"complete nontrivial one-block C128 decoder; forced-portable profile versus production-default tiled-when-eligible profile","tiledOperationLabels":["conv1","block-0-res-1-conv1","conv2"]},"kernel":"AceTiledVaeConv1dKernel","maximumSingleDrainMilliseconds":20,"memory":{"biasBytes":512,"inputBytes":33554432,"inputTileBytes":11776,"reusableOutputBytes":33554432,"simultaneousFullOutputCopies":1,"weightBytes":458752,"weightTileBytes":4128,"workgroupStorageBytes":15904},"productionIntegration":{"canonical256FrameGraph":{"fallbackOperationFamilies":["K1","K7 dilation 3","K7 dilation 9"],"tiledOperationLabels":["conv1","block-3-res-1-conv1","block-4-res-1-conv1","conv2"],"tiledQuantumCount":365},"commit":"48148ad1c791d26653d95418f55720240bafddff","existingBackendCancellationTestsPassed":true,"fifoScheduling":{"oneCommandBufferOutstanding":true,"queueDrainAfterEveryQuantum":true,"realQueueEmptyIntervalAfterEveryQuantum":true},"requiredWorkgroupStorageBytes":16384,"selector":"fail-closed tiled-when-eligible with scalar fallback"},"productionIntegrationPerformed":true,"representative":{"outputElements":8388608,"outputRangeCount":32,"shape":{"batch":1,"dilation":1,"inputChannels":128,"inputFrames":65536,"kernelSize":7,"outputChannels":128,"padding":3,"stride":1},"validMultiplyAdds":7515996160},"representativeActiveWallMilliseconds":{"max":223.69999992847443,"median":211.5000001192093,"min":205.2000002861023,"range":18.49999964237213,"sampleCount":4,"samples":[223.69999992847443,205.2000002861023,207.80000001192093,215.20000022649765]},"representativeLogicalGmacPerSecond":{"max":36.627661547372035,"median":35.54750392167586,"min":33.598552357635924,"range":3.0291091897361113,"sampleCount":4,"samples":[33.598552357635924,36.627661547372035,36.16937516635625,34.92563267699548]},"responsiveness":{"maximumAnimationFrameGapMilliseconds":7.400000000000546,"maximumTimerGapMilliseconds":12.100000023841858},"thermalGate":{"continuousNominalMilliseconds":30105.622292030603,"maximumObservedPollGapMilliseconds":1005.0422080093995,"nonNominalObservationCount":0,"observationCount":31,"passed":true},"thermallyIndependentPageRuns":1,"tiledRoundWins":4},"delta":{"medianActiveWallSpeedup":2.9881796679101207,"medianLogicalGmacPerSecondRatio":2.9869317248332288,"productionIntegrationPerformed":true,"scalarActiveWallDrift":{"firstMilliseconds":721.4999999403954,"lastMilliseconds":456.20000010728836},"tiledRoundWins":4,"worstPairedRoundSpeedup":2.1198884741038038}},"protocol":{"memorySamplingEnabled":false,"pairedOrder":["A","B","B","A","B","A","A","B"],"samples":4,"thermalGateSeconds":30,"thermalPollMilliseconds":1000,"thermalPollToleranceMilliseconds":250},"riskClass":"exact","schemaVersion":2}
