{"artifacts":[{"location":"optimization/artifacts/OPT-0015/raw/conv-transpose-congruent-ab.json","sha256":"7dcecd275c93d44a503924eef0ddb4b5a44d542e9ba4bb52d179ee5a6ff5cd61"}],"baselineCommit":"7d4916da0cd480fe03cd5712048cb3f3f4c06310","candidateCommit":"36608b857827b2b1d31ac91bf5cca9639fb0b9ed","correctness":{"listeningDecision":null,"listeningRequired":false,"oracleManifestSha256":"cb9e0546c58be371581f302b8cd3943c3209ca1dcec296b75838ebf01c0cf7eb","passed":true,"primitive":{"comparedU16Count":8404992,"completeSelectedRangeRawU16Comparison":true,"deterministicRerunHashes":true,"guardsAndAdjacentCanariesUntouched":true,"mismatchCount":0,"qNaNPrefillCompleteWrites":true},"production":{"exactPreCandidateFp16Wav":true,"wavSha256":"409b7157ac428910fae17776b1abbd9b42db7509984bcc0aac41871f95152ec2"}},"disposition":{"rationale":"The exact congruent kernel is selected only by the explicit OPT-0015 mixed FP16 VAE profile; the portable and OPT-0011 hybrid profiles remain unchanged.","revisitWhen":["the VAE package, ConvTranspose geometry, browser compiler, GPU, kernel source, or explicit runtime profile identity changes"],"state":"integrated"},"evidence":{"conclusion":"positive","rationale":"The exact primitive gate had zero mismatches across 8,404,992 raw-U16 comparisons and a 3.64348x weighted timing signal. Production integration reproduced the pre-candidate FP16 WAV exactly while reducing homogeneous transpose from 8,016.4 to 2,002.0 ms and decoder submit-to-drain from 14,118.3 to 7,265.8 ms in the 12-second profile. The historical 12-second total comparison is directional only; no 180-second or under-60-second claim is made."},"experimentId":"OPT-0015","hypothesis":"The exact production ConvTranspose1D geometry can enumerate only its approximately two congruent valid taps per output, preserving source reduction order while removing most tap staging and barriers.","identity":{"benchmarkHarnessCommit":"65603ade17b9f3b9ca92cc0c29be83fe51a6e885","browserVersion":"Google Chrome 151.0.0.0 (reduced user agent)","coreCommit":"075ecc0b34b7541cffc0a83412c17ee31bbadab6","ditManifestSha256":"d3fc0020efcf60702db411da2fd4b93e9bb84f1437ed310aef01c892727e452f","executionProfile":"12-second direct instrumental; mixed FP16/FP32 DiT; opt-0015-mixed-fp16-fixed32-k7-congruent-transpose-v1 VAE; cooperative FIFO graph owner","fixtureManifestSha256":"cb9e0546c58be371581f302b8cd3943c3209ca1dcec296b75838ebf01c0cf7eb","gpuCores":10,"integrationCommit":"36608b857827b2b1d31ac91bf5cca9639fb0b9ed","kernelCoreSourceSha256":"cbcb9bcd5f856ce1c9e10aabca0ec0f95651c03d2c45b8076de3ba5022c6c3e2","kernelId":"ace-vae-fp16-congruent-two-tap-conv-transpose1d-v1","machineModel":"MacBook Air Mac15,12; Apple M3","memoryBytes":17179869184,"modelManifestSha256":"18f36c6420976475af65ecd833ca56c6119706322ce54120389d4915d8e80db6","osBuild":"macOS 26.5.2 build 25F84","productionIntegrationPerformed":true,"runtimeProfile":"opt-0015-mixed-fp16-fixed32-k7-congruent-transpose-v1","vaeManifestSha256":"5644bcca87678b4f654b9541459355a73ef136c6bb601aa783b6f50fe2f6dba3","webgpuAdapter":{"features":["shader-f16","subgroups"],"info":{"architecture":"metal-3","description":"","device":"","isFallbackAdapter":false,"subgroupMaxSize":32,"subgroupMinSize":32,"vendor":"apple"},"limits":{"maxBufferSize":268435456,"maxComputeInvocationsPerWorkgroup":256,"maxComputeWorkgroupSizeX":256,"maxComputeWorkgroupStorageSize":16384,"maxComputeWorkgroupsPerDimension":65535,"maxStorageBufferBindingSize":134217728}}},"metrics":{"baseline":{"familyProfile":{"decoderSubmitThroughDrainMilliseconds":14118.300000786781,"homogeneousConvTransposeSubmitThroughDrainMilliseconds":8016.400000452995,"receiptSha256":"abd625696efbb3c12f9aa90924531ee780b322e167e69b64842f4b400deb3e76"},"production12Second":{"durationSeconds":12,"totalMilliseconds":33168.1,"vaeMilliseconds":15962.4}},"candidate":{"familyProfile":{"addMilliseconds":71.799999833107,"decoderSubmitThroughDrainMilliseconds":7265.799999117851,"fixed32K7Milliseconds":3019.800000190735,"homogeneousCongruentTransposeMilliseconds":2001.9999997615814,"k1Milliseconds":1177.2999993562698,"mixedMilliseconds":779.8999999761581,"snakeMilliseconds":215},"primitiveGate":{"classification":"separately drained exact-range weighted projection; not integrated decoder wall","comparedU16Count":8404992,"congruentProjectedMilliseconds":3830.9499965310097,"mismatchCount":0,"portableProjectedMilliseconds":13958.000004947186,"projectedSpeedup":3.643482691652564},"production12Second":{"durationSeconds":12,"full180SecondSongExecuted":false,"receiptSha256":"dc653f8f96e59dca39f408ab3e8ece0d0ef23e0d084c075e05e21953120f4ae1","totalMilliseconds":23018.200000047684,"vaeMilliseconds":8054.5,"wavExactPreCandidateFp16":true,"wavSha256":"409b7157ac428910fae17776b1abbd9b42db7509984bcc0aac41871f95152ec2"},"productionIntegrationPerformed":true},"delta":{"decoderProfileSavingMilliseconds":6852.50000166893,"decoderProfileSpeedup":1.9431170693524318,"homogeneousTransposeSavingMilliseconds":6014.400000691414,"homogeneousTransposeSpeedup":4.004195804898936,"observed180SecondProductSpeedup":null,"production12SecondTotalSavingMilliseconds":10149.899999952315,"production12SecondTotalSpeedup":1.440951073495377,"production12SecondVaeSavingMilliseconds":7907.9,"production12SecondVaeSpeedup":1.981798994350984,"productionTotalComparisonAttributableSolelyToOpt0015":false,"under60SecondProjection":null}},"protocol":{"integratedRunThermal":{"completedAt":"2026-08-14T22:36:32.357Z","durationMilliseconds":30125,"launchDelayMilliseconds":263,"maximumPollGapMilliseconds":1015,"observationCount":31,"observedLevels":[0],"startedAt":"2026-08-14T22:36:02.236Z","unchangedThermalRetryPerformed":false},"memorySamplingEnabled":false,"primitiveSamplesPerArmPerStratum":2,"productionBaselineComparison":"one earlier comparable 12-second product checkpoint; not a contemporaneous paired A/B","samples":1,"thermalGateSeconds":30,"thermalPollMilliseconds":1000,"thermalPollToleranceMilliseconds":250},"riskClass":"exact","schemaVersion":2}
