{"artifacts":[{"location":"optimization/artifacts/OPT-0014/raw/packed-kio-k7-ab.json","sha256":"2445e5e3b07a3d950db8e7badcd74bff6fef687013bbc7fd56389acaedd845c3"}],"baselineCommit":"36608b857827b2b1d31ac91bf5cca9639fb0b9ed","candidateCommit":"12e128ab323c0024ed683313b4d06c07041213e7","correctness":{"cleanup":{"createdBufferCount":178,"destroyedBufferCount":178,"deviceDestroyed":true,"idempotent":true,"liveBufferCount":0,"liveBytes":0,"maximumLiveBytes":583306496},"listeningDecision":null,"listeningRequired":false,"passed":true,"primitive":{"comparedU16WordCount":12599296,"comparedU32WordCount":1255424,"comparedWordCount":13854720,"deterministicRerunHashes":true,"executionsPerProbe":2,"guardsAndAdjacentCanariesUntouched":true,"mismatchCount":0,"operationCount":17,"probeCount":51,"qNaNPrefillCompleteWrites":true,"rawU16ExceptFinalRawU32":true},"repack":{"comparedU16WordCount":61017600,"deterministicRerunHashes":true,"executionsPerOperation":2,"mismatchCount":0,"operationCount":17,"packedPayloadBytes":61017600,"qNaNPrefillCompleteWrites":true,"redzonesUntouched":true,"uniqueU16WordCount":30508800}},"disposition":{"rationale":"Do not integrate the unchanged all-17-operation packed-KIO geometry or duplicate its weights in the production runtime. Preserve the candidate source, frozen gate, exactness proof, and mixed timing evidence as a benchmark record.","revisitWhen":["a materially different K7 geometry or layout strategy replaces rather than duplicates weights and addresses the measured shape regressions","later integrated profiling changes K7's decision value enough to justify another bounded mechanism","the target browser, compiler, GPU, subgroup capability, source, or production geometry changes enough to invalidate this result"],"state":"abandoned"},"evidence":{"conclusion":"negative","rationale":"The packed-KIO candidate was exact across 13,854,720 raw output-word comparisons and its repack was exact across 61,017,600 U16 comparisons. However, the exact-C300 weighted primitive projection improved only from 9,506.499997437 to 8,562.849999070168 ms (1.1102027944515322x) while retaining 61,017,600 additional packed-weight bytes; 15 of 50 timing strata regressed and two tied. This is negative evidence for integrating this duplicate-layout geometry, not evidence against every possible K7 optimization. No integrated decoder, generation, listening, or product-speed measurement was performed."},"experimentId":"OPT-0014","hypothesis":"GPU-repacking each authenticated K7 weight tensor bit-for-bit from native O-K-I order into K-I-O order, then using a fixed-32 subgroup tile of 16 rows by 64 output channels, can materially accelerate production VAE decoding while preserving every output's increasing-K then increasing-Cin FP32 arithmetic.","identity":{"benchmarkHarnessCommit":"3904d212148cf2ecf93f317f8dcce3d59ef232a8","browserVersion":"Google Chrome 151.0.0.0 (reduced user agent)","coreCommit":"12e128ab323c0024ed683313b4d06c07041213e7","executionProfile":"benchmark-only deterministic finite-FP16 exact-C300 17-operation fixed32-versus-packed-KIO K7 primitive gate; synthetic bindings; no production package or runtime integration","fixed32CoreSourceSha256":"7d218516d6b2c8d6e3332a53101be5fdeae1142096c442433915bfa58941ce32","fixed32GeneratedAggregateSha256":"c11cc6fc47481942ed412ff0ff415774f6c0614b2f0280ae5353b74bbe040fc2","fixtureManifestSha256":"cb9e0546c58be371581f302b8cd3943c3209ca1dcec296b75838ebf01c0cf7eb","gpuCores":10,"harnessSourceSha256":{"html":"2d21b577597d38848c2d7f4474088483e8a567e11b4ecd2de1081f4e75c5ebb0","staticContract":"30e3de58f4ebfc4cd2d70346f851caca58ba3866be018504a365bc55cd671774","typescript":"11e30051f3409d3212013826f55e63c0c080d036f5dcb6eaf2c567c2595fd1d4"},"kernelIds":{"fixed32":"ace-vae-fp16-fixed32-subgroup-k7-conv1d-v1","packedKio":"ace-vae-fp16-opt-0014-fixed32-packed-kio-k7-conv1d-v1","repack":"ace-vae-fp16-opt-0014-o-k-i-to-k-i-o-u16-repack-v1"},"machineModel":"MacBook Air Mac15,12; Apple M3","memoryBytes":17179869184,"modelManifestSha256":"18f36c6420976475af65ecd833ca56c6119706322ce54120389d4915d8e80db6","osBuild":"macOS 26.5.2 build 25F84","packageIdentityRole":"model and fixture manifests are provenance only; the gate used deterministic synthetic finite-FP16 tensors","packedKioCoreSourceSha256":"802cb0ad1d2c57c0cc51cbd4a7c88632e00d543b526f2ed0b94e9fc393a3d8d8","packedKioGeneratedAggregateSha256":"d38cdcbd0dbe61c6e302bd6d9a5d7810083e0c527c1e99961fa613ea06d285f1","productionIntegrationPerformed":false,"productionPackageLoaded":false,"productionRuntimeSelected":false,"repackGeneratedAggregateSha256":"31e664d13c27d626479f481cf0ca162748c9dd6b22753e1627e9cb0754217ef0","webgpuAdapter":{"features":["bgra8unorm-storage","clip-distances","core-features-and-limits","depth-clip-control","depth32float-stencil8","dual-source-blending","float32-blendable","float32-filterable","indirect-first-instance","primitive-index","rg11b10ufloat-renderable","shader-f16","subgroups","texture-component-swizzle","texture-compression-astc","texture-compression-astc-sliced-3d","texture-compression-bc","texture-compression-bc-sliced-3d","texture-compression-etc2","texture-formats-tier1","texture-formats-tier2","timestamp-query"],"info":{"architecture":"metal-3","description":"","device":"","isFallbackAdapter":false,"subgroupMaxSize":32,"subgroupMinSize":32,"vendor":"apple"},"limits":{"maxBufferSize":268435456,"maxComputeInvocationsPerWorkgroup":256,"maxComputeWorkgroupSizeX":256,"maxComputeWorkgroupsPerDimension":65535,"maxStorageBufferBindingSize":147456000,"minStorageBufferOffsetAlignment":256,"minUniformBufferOffsetAlignment":256}}},"metrics":{"baseline":{"arm":"current-fixed32-K7","exactC300OperationCount":17,"exactC300RangeCount":2404,"kernelId":"ace-vae-fp16-fixed32-subgroup-k7-conv1d-v1","persistentPackedWeightBytes":0,"weightedProjectedMilliseconds":9506.499997437},"candidate":{"arm":"packed-KIO-K7","exactC300OperationCount":17,"exactC300RangeCount":2404,"guardedPackedAllocationBytes":61026304,"kernelId":"ace-vae-fp16-opt-0014-fixed32-packed-kio-k7-conv1d-v1","persistentPackedWeightBytes":61017600,"productionIntegrationPerformed":false,"repack":{"commandBufferCount":1,"computePassCount":1,"dispatchCount":17,"includedInConvProjection":false,"submitAndDrainCount":1,"totalMilliseconds":4.5,"workgroupCount":59588},"timingStratumCount":50,"weightedProjectedMilliseconds":8562.849999070168},"delta":{"candidateStratumLosses":15,"candidateStratumTies":2,"candidateStratumWins":33,"maximumStratumSpeedup":3.030302964622982,"minimumStratumSpeedup":0.47752809116687156,"observed12SecondProductSpeedup":null,"observed180SecondProductSpeedup":null,"observedIntegratedDecoderSpeedup":null,"persistentPackedWeightBytesDelta":61017600,"productionIntegrationPerformed":false,"projectedSavingMilliseconds":943.6499983668327,"projectedSpeedup":1.1102027944515322,"under60SecondProjection":null},"logicalGpuPeakBytes":583306496},"protocol":{"allPipelinesCompiledAndWarmedBeforeTiming":true,"armLabels":{"A":"current-fixed32-K7","B":"packed-KIO-K7"},"authoritativeTiming":"performance.now-submit-through-queue-drain","convTimingExclusions":["compile","allocation","upload","readback","cleanup","repack"],"correctnessAndRepackVerificationCompletedBeforeThermalGate":true,"correctnessExecutionsPerProbe":2,"exactC300GraphRangeWeights":true,"memorySamplingEnabled":false,"pairedOrder":["A","B","B","A"],"samples":2,"thermal":{"completedAtEpochMilliseconds":1786750081158,"durationMilliseconds":30118,"launchDelayMilliseconds":76,"maximumPollGapMilliseconds":1005,"nonNominalObservationCount":0,"observationCount":31,"source":"notifyutil-com.apple.system.thermalpressurelevel","startedAtEpochMilliseconds":1786750051040},"thermalGateSeconds":30,"thermalPollMilliseconds":1000,"thermalPollToleranceMilliseconds":250,"unchangedThermalRetryPerformed":false},"riskClass":"exact","schemaVersion":2}
